[
  {
    "id": "WP-0001",
    "name": "Billing team off legacy POST /invoices",
    "target_date": "2026-09-30",
    "teams": ["Billing team"],
    "interfaces": ["IFC-SYNC-0002"],
    "status": "pending",
    "rationale": "Gates CTX-0002's Stage 8 decommission step; matches retirement.json's sunset_date for IFC-SYNC-0002.",
    "evidence": [ { "source": "config", "locator": "retirement.json#IFC-SYNC-0002" } ]
  },
  {
    "id": "WP-0002",
    "name": "Shipping team off legacy GET /shipments/{id}",
    "target_date": "2026-08-15",
    "teams": ["Shipping team"],
    "interfaces": ["IFC-SYNC-0001"],
    "status": "at-risk",
    "rationale": "Target date is close and IFC-SYNC-0001 is still active with zero_traffic_days at 0 — no evidence of migration progress yet. Gates CTX-0003's Stage 8 decommission step.",
    "evidence": [ { "source": "config", "locator": "retirement.json#IFC-SYNC-0001" } ]
  }
]
